document,count_sents,all_passives,passive_count,passive_sents_count,passive_percentages,binary,Unnamed: 0,PassiveMatch(es),PassiveCount,ID,Test,Cond,human_coding,match
I wish i had asked more questions to my grandmother about our culture.,1,[],0,0,0.0,0,797,,0,AM0FRMVODTMXA,1.0,1,0,True
I am going the Culture fair today. ,1,[],0,0,0.0,0,798,,0,A2WSYQ5TS09U1,1.0,1,0,True
I bow when greeting my elders. ,1,[],0,0,0.0,0,799,,0,A1FAQI8VXLAMBM,2.0,1,0,True
My culture tells me about where I am from.,1,[],0,0,0.0,0,800,,0,A3C9B757QTE20C,2.0,1,0,True
Culture can mean lot to people.,1,[],0,0,0.0,0,801,,0,AK70USZXEJSF3,2.0,2,0,True
I love to integrate myself in other cultures.,1,[],0,0,0.0,0,802,,0,A3BWZ6V34W8SXX,2.0,1,0,True
"Comic book art used to be looked down upon, but it is now seen as viable art form. ",1,"['be looked', 'is now seen']",2,1,1.0,1,803,"['be looked', 'is now seen']",2,A3U6RDG7BLH6YZ,2.0,1,1,False
My thoughts about today culture isn popular.,1,[],0,0,0.0,0,804,,0,A2HUWXLMG214BI,2.0,2,0,True
The father was proud oh his sons eagerness to learn their native language.,1,[],0,0,0.0,0,805,,0,A16DIQCMNWPBAN,2.0,2,0,True
I want to see the new African Art exhibit and the museum. ,1,[],0,0,0.0,0,806,,0,A357ADRGNGMMKC,1.0,1,0,True
Their culture is very colorful.,1,[],0,0,0.0,0,807,,0,A3V2HVY764HJS4,2.0,1,0,True
Many cultures are appropriated by white people ,1,['are appropriated'],1,1,1.0,1,808,['are appropriated'],1,A2W5PAZJG6X8Q8,2.0,2,1,True
"In culture many people enjoy their food, dance, and customs of their ancestors. ",1,[],0,0,0.0,0,809,,0,A118RTS8BOFIH7,1.0,1,0,True
The movie was made hit by the actors.,1,['was made'],1,1,1.0,1,810,['was made'],1,A31CNXHGR49DJR,1.0,2,1,True
Culture is passed down,1,['is passed'],1,1,1.0,1,811,['is passed'],1,A3OM2ZQ7FUDTIN,1.0,1,1,True
"The society had such rich culture, there was much to learn of them.",1,[],0,0,0.0,0,812,,0,A3PSV85ZUXP9VF,2.0,2,0,True
I did not know about the sneaker culture around my school. ,1,[],0,0,0.0,0,813,,0,A3G11HOZ5PCWOH,2.0,2,0,True
Culture is the way we know how to act in public. ,1,[],0,0,0.0,0,814,,0,A33ELVLU0NX9N9,1.0,1,0,True
The Aztecs ruled Mesoamerica.,1,[],0,0,0.0,0,815,,0,A2W434UNNBRS4L,1.0,2,0,True
there is cultural difference beet week different people,1,[],0,0,0.0,0,816,,0,A2EW08X2I87RXL,2.0,1,0,True
The gallery opening was attended by many important figures.,1,['was attended'],1,1,1.0,1,817,['was attended'],1,AHTWQSOY6HTJI,1.0,2,1,True
"When we went to Puerto Rico, the culture was beautiful.",1,[],0,0,0.0,0,818,,0,A16Y5JEB1EF9CY,1.0,2,0,True
"Culture is best ignored, maybe.",1,[],0,0,0.0,0,819,,0,A3M0L33TPD346S,2.0,2,1,False
My favorite celebrity spoke out against racism last week.,1,[],0,0,0.0,0,820,,0,AY4KZOUEZ8BAM,1.0,1,0,True
Culture both divides and unites people.,1,[],0,0,0.0,0,821,,0,A14Z1JSAR9JEON,1.0,2,0,True
"Cultures, comes in many color shapes and sizes.",1,[],0,0,0.0,0,822,,0,A3M2Q7EZCJ85GE,2.0,2,0,True
We need to do more about different culture.,1,[],0,0,0.0,0,823,,0,A36W1PIV68AE5K,2.0,2,0,True
I eat Kimchi since it is part of my Korean culture.,1,[],0,0,0.0,0,824,,0,ANR81FZBHHR0F,1.0,1,0,True
The girls culture was forgotten about.,1,['was forgotten'],1,1,1.0,1,825,['was forgotten'],1,A2UOOBZQ5L2EL1,2.0,2,1,True
Our differences in culture is perhaps what I find most interesting.,1,[],0,0,0.0,0,826,,0,j2wj0096lt,2.0,1,0,True
I love how this cuisine tastes ,1,[],0,0,0.0,0,827,,0,A3NUGUAMBKYMZY,1.0,1,0,True
Culture makes up our characters.,1,[],0,0,0.0,0,828,,0,A33TBDS0UALKW2,1.0,1,0,True
The weekend was improved by the opening of the museum.,1,['was improved'],1,1,1.0,1,829,['was improved'],1,A2BT7QVGXJKFKI,1.0,2,1,True
Jill studies modern art at the local college.,1,[],0,0,0.0,0,830,,0,A39J8MSTUDVH0D,1.0,1,0,True
Culture is the core of our society.,1,[],0,0,0.0,0,831,,0,A15X9KAJB8M54B,2.0,2,0,True
The woke culture is hilarious.,1,[],0,0,0.0,0,832,,0,A1CRE2Z623JZ6V,2.0,1,0,True
Television has become more diverse in 2020.,1,[],0,0,0.0,0,833,,0,A3H8A6SSZH6MQQ,2.0,2,0,True
Culture was the main drive of the museum visit.,1,[],0,0,0.0,0,834,,0,A2137K4XEU12TI,1.0,2,0,True
Having an expressive personality is part of LGBTQ culture.,1,[],0,0,0.0,0,835,,0,AMFIHFK9N0OVK,2.0,1,0,True
I love studying different cultures.,1,[],0,0,0.0,0,836,,0,A1JAWNX4R60ZZ0,1.0,1,0,True
I celebrate Christmas with my family.,1,[],0,0,0.0,0,837,,0,A1MPJYJCUAOFOB,1.0,1,0,True
I hear very little about culture.,1,[],0,0,0.0,0,838,,0,A3HT6YYXPBRKN3,2.0,2,0,True
My culture needs to work together to improve so that we can acheive.,1,[],0,0,0.0,0,839,,0,A3V9UGWBPDRFSG,1.0,1,0,True
careers revolve around persons culture.,1,[],0,0,0.0,0,840,,0,A1ZJ3TU4QJIKLY,2.0,2,0,True
learning about different cultures is interesting.,1,[],0,0,0.0,0,841,,0,A129LL7SYP8EOE,2.0,1,0,True
Cultural studies will always be considered an important part of liberal arts education.,1,['be considered'],1,1,1.0,1,842,['be considered'],1,A2VUF0V7HT51Q3,1.0,2,1,True
I did not check on anything about my culture.,1,[],0,0,0.0,0,843,,0,A3IB7YJHP04OHI,2.0,2,0,True
I love to learn about different cultures.,1,[],0,0,0.0,0,844,,0,A13DHPKBQXN9R7,2.0,1,0,True
I do not know much about pop culture.,1,[],0,0,0.0,0,845,,0,A1B3K5W6NZ03U2,1.0,1,0,True
"The movie was watched by 3,000 people.",1,['was watched'],1,1,1.0,1,846,['was watched'],1,A29KJK7GPUF3OT,1.0,2,1,True
The festival is scheduled for next week.,1,['is scheduled'],1,1,1.0,1,847,['is scheduled'],1,A26A77APE2SUR5,2.0,2,1,True
The work culture at Google is very relaxed.,1,[],0,0,0.0,0,848,,0,A8BSFVAPZBIUS ,1.0,1,0,True
I want to know how to make sushi ,1,[],0,0,0.0,0,849,,0,A1ADRYNCJIRFOO,1.0,1,0,True
The traditional dance was performed by the women in the group.,1,['was performed'],1,1,1.0,1,850,['was performed'],1,A1PAN54I7HWSZI,1.0,2,1,True
The culture is changing at breakneck speed ,1,[],0,0,0.0,0,851,,0,AS8JG1LSWTMGY,2.0,2,0,True
Great Britain culture is overdue for change.,1,[],0,0,0.0,0,852,,0,A25D8WXH1F4CG9,1.0,1,0,True
My culture revolves around my Italian upbringing. ,1,[],0,0,0.0,0,853,,0,A1TK1M16KJJKEO,1.0,2,0,True
Leah loved to learn of her culture as time went on.,1,[],0,0,0.0,0,854,,0,A1282WX3YWXM6E,2.0,1,0,True
CONCERTS ARE A FUN THING TO DO ON THE WEEKENDS,1,[],0,0,0.0,0,855,,0,A3SUUPLFBSG1T9,1.0,1,0,True
Culture was changed by altering the story.,1,['was changed'],1,1,1.0,1,856,['was changed'],1,A2T6EBB0Z6TQZS  ,1.0,2,1,True
The young girls sighed as they were tired from dancing on Tik Tok. ,1,[],0,0,0.0,0,857,,0,A3G1X3IP2VM4IK,2.0,2,0,True
Her culture was known to celebrate on that day.,1,['was known'],1,1,1.0,1,858,['was known'],1,A1KRDCZ1YYBUIZ,1.0,1,1,True
We were interested in the Asian exhibits. ,1,[],0,0,0.0,0,859,,0,A1X84CLJ7N1PLZ,1.0,2,0,True
Choose your culture wisely.,1,[],0,0,0.0,0,860,,0,A141B3S3ZLY8DI,2.0,2,0,True
The culture dictates the rules.,1,[],0,0,0.0,0,861,,0,A1BDJMFP24FBGL,1.0,1,0,True
the show told me about culture,1,[],0,0,0.0,0,862,,0,A3F34OE3VQ7W0V,1.0,2,0,True
Minority cultures assimilate into the dominant culture over time.,1,[],0,0,0.0,0,863,,0,A2BQ5JORLYGZMV,2.0,2,0,True
We are celebrating Christmas ,1,[],0,0,0.0,0,864,,0,A3ONF400XL2Y9U,1.0,1,0,True
Downtown is full of culture.,1,[],0,0,0.0,0,865,,0,A2HDZE2L9EX2SY,1.0,1,0,True
Americans are mindconrolled by NBA,1,['are mindconrolled'],1,1,1.0,1,866,['are mindconrolled'],1,A2EY0J9LOPU3TU,1.0,2,1,True
Pop culture is unimportant in the grand scheme of things.,1,[],0,0,0.0,0,867,,0,A20SXG1DHDIDI7,1.0,1,0,True
The culture exhibit was victimized by vandalism,1,['was victimized'],1,1,1.0,1,868,['was victimized'],1,A2Y81T0DIFJ866,1.0,2,1,True
I really enjoy embracing my culture and uplifting those who do as well ,1,[],0,0,0.0,0,869,,0,A2MF4QDKE40KVN,1.0,1,0,True
we all have different cultures,1,[],0,0,0.0,0,870,,0,A7Z6P6K85HX54,1.0,2,0,True
Culture varies across our country.,1,[],0,0,0.0,0,871,,0,A2PY9UB56M2PP2,1.0,1,0,True
American culture is in decline. ,1,[],0,0,0.0,0,872,,0,A2JUTTLDE5LGHH,1.0,2,0,True
The french has an unique culture,1,[],0,0,0.0,0,873,,0,A2F58OOW7K3DD2,1.0,1,0,True
It was in Marvin culture to celebrate different holiday.,1,[],0,0,0.0,0,874,,0,A1QW2XUJ7KZCV5,2.0,2,0,True
They just always do things the wrong way. ,1,[],0,0,0.0,0,875,,0,A3G3TIX6FEMN8R,2.0,2,0,True
Cats don like to eat asparagus.,1,[],0,0,0.0,0,876,,0,A2DDPSXH2X96RF,1.0,1,0,True
I love the culture,1,[],0,0,0.0,0,877,,0,A2BZY06YRWGEDL,2.0,1,0,True
The trend was popular among teens.,1,[],0,0,0.0,0,878,,0,A1C8FN01981A69,2.0,2,0,True
 Chinese is sub-category of Asian.,1,[],0,0,0.0,0,879,,0,A2DU76P3SED4T6,2.0,1,0,True
I wanted to be at the top of culture,1,[],0,0,0.0,0,880,,0,AYSX5GNO640MZ,1.0,1,0,True
I made my mother famous Italian dish for my friends.,1,[],0,0,0.0,0,881,,0,A2R30HQXQN76IC,1.0,1,0,True
Some say culture is dead in the 21st century.,1,[],0,0,0.0,0,882,,0,AMDUEMZUK9GJC,1.0,1,0,True
The walls were covered in vibrant grafitti.,1,['were covered'],1,1,1.0,1,883,['were covered'],1,A2WS07SCLNP1GV,1.0,2,1,True
Culture has become very large separator among society today. ,1,[],0,0,0.0,0,884,,0,A3V3LIPOU53GZQ,2.0,2,0,True
I ve never been to Safari before.,1,[],0,0,0.0,0,885,,0,AQDA6OMC4W5V8,1.0,2,0,True
Billy has learned lot about his culture.,1,[],0,0,0.0,0,886,,0,A1K3VCFF62LIO2,2.0,1,0,True
Culture plays huge role in how we see ourselves.,1,[],0,0,0.0,0,887,,0,A2AFAWJX5LTUVN,2.0,1,0,True
The new rock band is going to be touring soon.,1,[],0,0,0.0,0,888,,0,AW8JVJQNLTXND,2.0,1,0,True
Observing culture is important in society.,1,[],0,0,0.0,0,889,,0,A26ZENZ5G8AEGM,1.0,1,0,True
The character of nation is reflected by its culture.,1,['is reflected'],1,1,1.0,1,890,['is reflected'],1,A3Q9H7A8J8GR01,1.0,2,1,True
The natives had culture that recognized adulthood at age 12. ,1,[],0,0,0.0,0,891,,0,A2SULQE4M8C3CM,2.0,2,0,True
Culture shapes relationships amongst people.,1,[],0,0,0.0,0,892,,0,A2LDDDJ4WBKB8Y,1.0,1,0,True
The Mayan culture is very interesting topic to read,1,[],0,0,0.0,0,893,,0,A2VJ27EN5W4MU,1.0,2,0,True
She is learning about the culture.,1,[],0,0,0.0,0,894,,0,A1SBWRAOJBEFIM,1.0,1,0,True
CULTURE BUILT EVERY TRADITION IN A COMMUNITY.,1,[],0,0,0.0,0,895,,0,A12JQZP4XVOABB,2.0,2,0,True
I attend cultural show,1,[],0,0,0.0,0,896,,0,AE5138F868GYB,1.0,1,0,True
I believe culture is benefit to society.,1,[],0,0,0.0,0,897,,0,AY2L2CZ6OKNEA,2.0,1,0,True
Cheeseburgers are eaten by Americans.,1,['are eaten'],1,1,1.0,1,898,['are eaten'],1,A2S7LNJG767XIU,1.0,2,1,True
"To Dalton, the meaning of culture includes language, arts, cuisine, music, social habits and religions.",1,[],0,0,0.0,0,899,,0,A370S3V5OUNP4E,1.0,1,0,True
He was going to date outside of his culture.,1,[],0,0,0.0,0,900,,0,A2ZKKOPPN3AX2G,1.0,2,0,True
Culture today is out of hand.,1,[],0,0,0.0,0,901,,0,AH7I3K3OJKA5L,2.0,1,0,True
Teens love alternative music.,1,[],0,0,0.0,0,902,,0,A5BCSSPC180AG,2.0,2,0,True
The culture of the country is not inviting.,1,[],0,0,0.0,0,903,,0,A1TO9C7AZND1VO,1.0,1,0,True
I wonder about her culture.,1,[],0,0,0.0,0,904,,0,AE0C5U5HZ7WR9,2.0,2,0,True
I teach American Culture at junior college in my state.,1,[],0,0,0.0,0,905,,0,A1D4RC6K6Y5KAV,2.0,1,0,True
I am celebrating Christmas with my family because I grew up in the western culture.,1,[],0,0,0.0,0,906,,0,A345TDMHP3DQ3G,1.0,1,0,True
Their culture was hard to discover ,1,[],0,0,0.0,0,907,,0,A1U5UPSCURNRAA,2.0,2,0,True
It is very important to learn about Culture.,1,[],0,0,0.0,0,908,,0,A18UTX5FD7NPRV,2.0,1,0,True
There had been great deal of hand wringing about the decline in our culture. ,1,[],0,0,0.0,0,909,,0,A3T79IEUFBB473,2.0,2,0,True
Music effects everyone.,1,[],0,0,0.0,0,910,,0,A3HKD5JYXYBK5Q,1.0,1,0,True
Cultures are part of yogurt.,1,[],0,0,0.0,0,911,,0,A3MSMV01T3S53S,2.0,1,0,True
I loved experiencing the Italian culture when I was there.,1,[],0,0,0.0,0,912,,0,A2JAE9P7FQXU2T,2.0,2,0,True
Everyone has different and exciting culture.,1,[],0,0,0.0,0,913,,0,A23K77HMD9APAJ,1.0,1,0,True
Culture gives unique personality to many countries. ,1,[],0,0,0.0,0,914,,0,A322UHGPRL2UWO,2.0,1,0,True
The Mayan beliefe were of future that would end in 2012.,1,[],0,0,0.0,0,915,,0,A1EDKVYT9ZCGUH,2.0,2,0,True
I come from long line of Irish Heritage.,1,[],0,0,0.0,0,916,,0,A3CX8S6Q0QEW8E,1.0,1,0,True
The culture was already discussed in the book.,1,['was already discussed'],1,1,1.0,1,917,['was already discussed'],1,AYX9OCFWBM939,2.0,2,1,True
They had gone to temple to learn about her culture.,1,[],0,0,0.0,0,918,,0,A1HNB2243A2PQH,2.0,2,0,True
Culture has always been an interesting topic to study.,1,[],0,0,0.0,0,919,,0,A1Y38T7IZWJQAE,2.0,2,0,True
The business was made slow by the pandemic.,1,['was made'],1,1,1.0,1,920,['was made'],1,A3ATU3VULAB7K2,2.0,2,1,True
I want new business card.,1,[],0,0,0.0,0,921,,0,A1CTJ8UT7SF317,1.0,1,0,True
I don know much about business.,1,[],0,0,0.0,0,922,,0,A327Q0Y175MEH7,1.0,1,0,True
The store owner had to close for the winter.,1,[],0,0,0.0,0,923,,0,A19TD2J8506A4Y,1.0,2,0,True
The CEO has just reviewed the financial statements.,1,[],0,0,0.0,0,924,,0,A2DDXYTEVDV5F5,1.0,1,0,True
I wish the stocks would go up. ,1,[],0,0,0.0,0,925,,0,AJ9O2ZA0E8UDZ,2.0,2,0,True
They invested wisely.,1,[],0,0,0.0,0,926,,0,AYXXMHLZRAPF9,1.0,1,0,True
Business is in shambles right now.,1,[],0,0,0.0,0,927,,0,A3M0L33TPD346S,1.0,1,0,True
The boom in the economy was led by business.,1,['led by'],1,1,1.0,1,928,['led by'],1,A33GB614ST7J82,1.0,2,1,True
 The company worked hard to be the top in their field.,1,[],0,0,0.0,0,929,,0, COPIEDAKHKMEPXX1YZ9,2.0,1,0,True
Profits increased this fiscal year.,1,[],0,0,0.0,0,930,,0,A23273YME4RCEB,1.0,1,0,True
The business was fined for operating without license.,1,['was fined'],1,1,1.0,1,931,['was fined'],1,A3O4WYGKH31OX,1.0,2,1,True
The entire meal was paid for by my boss.,1,['was paid'],1,1,1.0,1,932,['was paid'],1,A3NLSGHK6RFXA8,1.0,2,1,True
Joe attended the business meeting.,1,[],0,0,0.0,0,933,,0,AOJF7CPZVK5U3,1.0,1,0,True
The stock market was paid attention to.,1,['was paid'],1,1,1.0,1,934,['was paid'],1,A154ZJKRSX6847,1.0,2,1,True
Business interests are regulated by the federal government.,1,['are regulated'],1,1,1.0,1,935,['are regulated'],1,A3FXVNZ5VG98IP,1.0,2,1,True
I started my own small business when I was very young.,1,[],0,0,0.0,0,936,,0,AYXN53TNFG71P,1.0,1,0,True
The meeting was rescheduled for tomorrow. ,1,['was rescheduled'],1,1,1.0,1,937,['was rescheduled'],1,AMUKX1DM4ASA7,1.0,2,1,True
China is great place to travel to.,1,[],0,0,0.0,0,938,,0,AFE7E450NETF2,1.0,1,0,True
BUSINESS MEN NOT FINE ALL THE TIME. ,1,[],0,0,0.0,0,939,,0,A2DLZ9PK82J8L2,1.0,1,0,True
Business is cut throat sport. ,1,['is cut'],1,1,1.0,1,940,['is cut'],1,ARON01UO1YK7I,2.0,2,0,False
Local retail stores are great convenience. ,1,[],0,0,0.0,0,941,,0,A3RNGN5WLE1OBU,1.0,1,0,True
I wish I was able to get more money at the bank.,1,[],0,0,0.0,0,942,,0,A1ZZETG57T5D5X,2.0,2,0,True
Business is very interesting ,1,[],0,0,0.0,0,943,,0,A2Z75NJBZ46RE9,1.0,1,0,True
Big Business was sued by the government.,1,['was sued'],1,1,1.0,1,944,['was sued'],1,A1CI5U3BLQ2DDS,1.0,2,1,True
 Business is good for the economy. ,1,[],0,0,0.0,0,945,,0,A1CI5U3BLQ2DDS ,1.0,1,0,True
The salesperson demonstrated his company products in meeting. ,1,[],0,0,0.0,0,946,,0,ATSNZCC16HIOI,1.0,1,0,True
I want to own business ,1,[],0,0,0.0,0,947,,0,A1SWGSFIMZJQE,2.0,2,0,True
Business is very broad category. ,1,[],0,0,0.0,0,948,,0,A33UZLF8WW0DV1,2.0,2,0,True
Schedule all orientation meetings today before leaving the office.,1,[],0,0,0.0,0,949,,0,A39GP79ULCP9J2,1.0,1,0,True
Business was good.,1,[],0,0,0.0,0,950,,0,A2X5BYJKVKSYQQ,1.0,1,0,True
She didn know how to organize the business ,1,[],0,0,0.0,0,951,,0,A12S5JDG2D5HEW,2.0,2,0,True
I am buying stock today.,1,[],0,0,0.0,0,952,,0,A1FAQI8VXLAMBM,2.0,1,0,True
The award was won by the top business.,1,['was won'],1,1,1.0,1,953,['was won'],1,A3P1QF00PF2DF9,1.0,2,1,True
I am looking for business to start up.,1,[],0,0,0.0,0,954,,0,A16ZLWV0QUJP65,2.0,1,0,True
Purdue Pharma settled the lawsuit with billions of dollars.,1,[],0,0,0.0,0,955,,0,AOJD8D9NXVAR3,1.0,1,0,True
That business has been closed for awhile.,1,['has been closed'],1,1,1.0,1,956,['been closed'],1,A1ZLWV0QUJP65,2.0,2,1,True
Jamal is fantastic business man. ,1,[],0,0,0.0,0,957,,0,AAL5LUI5U3NAV,1.0,1,0,True
Her business is of no concern of mine. ,1,[],0,0,0.0,0,958,,0,A1TK1M16KJJKEO,1.0,2,0,True
I work for large business,1,[],0,0,0.0,0,959,,0,A79XOBCSS4NTG,1.0,1,0,True
Business is hard.,1,[],0,0,0.0,0,960,,0,A2O3IWIVOZD4S7,1.0,1,0,True
Business is major at most colleges and universities.,1,[],0,0,0.0,0,961,,0,A2SVKAI2PNTS79,2.0,2,0,True
I closed this business.,1,[],0,0,0.0,0,962,,0,A2O3IWIVOZD4S7,1.0,1,0,True
The business was shown new idea.,1,['was shown'],1,1,1.0,1,963,['was shown'],1,A2VNR6984SDFGQ,1.0,2,1,True
The market was down. ,1,[],0,0,0.0,0,964,,0,A3CLBF224TRYC9,1.0,2,0,True
The girl entered the business located on Main Street.,1,[],0,0,0.0,0,965,,0,A8TLS2F8LFQ68,1.0,1,0,True
The business is open today. ,1,[],0,0,0.0,0,966,,0,AIJPLVW0ULYTH,2.0,1,0,True
I sure hadn wanted to visit that apple store since it was so busy.,1,[],0,0,0.0,0,967,,0,A3CX0LXFHZ6I3I,1.0,2,0,True
I ll start my business in the next few weeks.,1,[],0,0,0.0,0,968,,0,A2LEBJWW395FST,1.0,1,0,True
The fundraiser for the business brought in lot of money.,1,[],0,0,0.0,0,969,,0,AFTSLCMJASJDR,1.0,2,0,True
Her background was in Business,1,[],0,0,0.0,0,970,,0,AA0EJ752F121Q,2.0,2,0,True
The Business closed its doors promptly at 5pm.,1,[],0,0,0.0,0,971,,0,A2VN0R4EGGV7KE,2.0,1,0,True
I went to work today and it was long day.,1,[],0,0,0.0,0,972,,0,AJKA9BKC011F2,2.0,1,0,True
My family business is affected by the pandemic. ,1,['is affected'],1,1,1.0,1,973,['is affected'],1,A2X823PACMMOKP,1.0,1,1,True
I am leaving this business.,1,[],0,0,0.0,0,974,,0,ALG1XBLARJ545,1.0,2,0,True
The business was robbed during the night.,1,['was robbed'],1,1,1.0,1,975,['was robbed'],1,A2SKOPFTRTNFUY,1.0,2,1,True
Dressing up is required to attend meeting.,1,['is required'],1,1,1.0,1,976,['is required'],1,A347NXF6NQGM5G,1.0,2,0,False
The business is doing well,1,[],0,0,0.0,0,977,,0,AFRKVRPZ2RHY8,1.0,2,0,True
I am taking Business course and enjoying all that I am learning.,1,[],0,0,0.0,0,978,,0,A2OZKKX2O0YTLD,2.0,1,0,True
I called them and got the sale ,1,[],0,0,0.0,0,979,,0,A240OTT1T85UGT,1.0,1,0,True
My contributions to the business were not recognized by my father. ,1,['were not recognized'],1,1,1.0,1,980,,0,A55E4CZQLYYO3,2.0,2,1,False
The accountant met with the lawyer.,1,[],0,0,0.0,0,981,,0,A3QNSOORS63W0D,2.0,1,0,True
Business creates opportunity.,1,[],0,0,0.0,0,982,,0,A63XZD0XGIMAI,1.0,1,0,True
Long lunches are often taken when having business meetings.,1,['are often taken'],1,1,1.0,1,983,['are often taken'],1,A2ONKY3JGB34T3,1.0,2,1,True
The CEO made all final decisions for the company.,1,[],0,0,0.0,0,984,,0,AOJD8D9NXVAR3,1.0,1,0,True
Business grows with society.,1,[],0,0,0.0,0,985,,0,A33B85TN97HQ33,1.0,1,0,True
Sprint was bought out by T-Mobile.,1,['was bought'],1,1,1.0,1,986,['was bought'],1,A3J72C0SIACZBS,1.0,2,1,True
Is is expected that business will be good this year.,1,['is is expected'],1,1,1.0,1,987,['is expected'],1,AW3PWVBIGPNAA,1.0,2,1,True
The business is thriving.,1,[],0,0,0.0,0,988,,0,AC95JAUAM2L2Z,1.0,1,0,True
There no business like show business.,1,[],0,0,0.0,0,989,,0,AFE7E450NETF2,1.0,2,0,True
I am into business,1,[],0,0,0.0,0,990,,0,AXR1QGU4KTMSZ,1.0,1,0,True
The company was involved in community service.,1,[],0,0,0.0,0,991,['was involved'],1,COPIEDAKHKMEPXX1YZ9,2.0,2,0,False
Business is booming,1,[],0,0,0.0,0,992,,0,AOZBPO12UMPUY,1.0,1,0,True
Business is booming ,1,[],0,0,0.0,0,993,,0,A1JSPB0XCFUUG1,2.0,1,0,True
The accountant was fired.,1,['was fired'],1,1,1.0,1,994,['was fired'],1,A2VAG94W4SK18C,1.0,2,1,True
Business is no fun but it worth it.,1,[],0,0,0.0,0,995,,0,A2GIT09BQEUM9M,,1,0,True
Business was taken over. ,1,['was taken'],1,1,1.0,1,996,['was taken'],1,A162CO8K267FU8,1.0,2,1,True
I keep track of my own orders. ,1,[],0,0,0.0,0,997,,0,A3S9ASZKIIJ3WF,2.0,1,0,True
Business makes the world go round.,1,[],0,0,0.0,0,998,,0,A3JUAN2Y9XTK5L,2.0,1,0,True
He opened the business 10 years ago.,1,[],0,0,0.0,0,999,,0,A23FK9ROU01U4D,2.0,2,0,True
The business is not doing well,1,[],0,0,0.0,0,1000,,0,A79XOBCSS4NTG,1.0,2,0,True
The firm was able to make ton of money this quarter. ,1,[],0,0,0.0,0,1001,,0,AU34Y1DWWQ47O,1.0,1,0,True
i owned my business,1,[],0,0,0.0,0,1002,,0,A2TWX0MB777CAB,2.0,2,0,True
Business can be very challenging at times.,1,[],0,0,0.0,0,1003,,0,A1HYNGG8LZUV47,2.0,1,0,True
The business did not meet the state protocols to remain operational.,1,[],0,0,0.0,0,1004,,0,AQDBBBTN8NE9X,2.0,2,0,True
Business was boring subject.,1,[],0,0,0.0,0,1005,,0,A36G7I51D5O1M4,2.0,2,0,True
His business suffered due to the economy.,1,[],0,0,0.0,0,1006,,0,COPIEDAPV3GK8ZEXB0J,1.0,1,0,True
I take many business trips.,1,[],0,0,0.0,0,1007,,0,A38LW34F26WBJY,1.0,1,0,True
I run my business online,1,[],0,0,0.0,0,1008,,0,A35TZ4YGDSXSEC,1.0,1,0,True
Stock prices were mixed after investors faced uncertainty.,1,[],0,0,0.0,0,1009,,0,A37CSK5QI41636,1.0,2,0,True
It is time to close the doors on this business. ,1,[],0,0,0.0,0,1010,,0,ACIWLS3IQPV1J,2.0,1,0,True
My mom was doing taxes as I watched tv.,1,[],0,0,0.0,0,1011,,0,A1N274L13ZKKI5,1.0,2,0,True
This business is profitable every year.,1,[],0,0,0.0,0,1012,,0,A3NG205QJ48IM4,1.0,1,0,True
My cousin got degree in Business.,1,[],0,0,0.0,0,1013,,0,A2I6YPPQK6BU09,1.0,1,0,True
This business is failing fast. ,1,[],0,0,0.0,0,1014,,0,A1H4MYPDJ2K3VI,2.0,1,0,True
Salaries were reduced by the CEO.,1,['were reduced'],1,1,1.0,1,1015,['were reduced'],1,A15B294KHVGPFV,1.0,2,1,True
I really hate Apple,1,[],0,0,0.0,0,1016,,0,A3774HPOUKYTX7,1.0,1,0,True
They are growing the business.,1,[],0,0,0.0,0,1017,,0,ARTARDCXLJ5H6,2.0,2,0,True
The DOW is up.,1,[],0,0,0.0,0,1018,,0,A2RCUR9HJ9D0UQ,1.0,2,0,True
I studied business in college.,1,[],0,0,0.0,0,1019,,0,AO9AKYPPGGGZ4,2.0,1,0,True
I am an important business man,1,[],0,0,0.0,0,1020,,0,ADIW4L4IGU98R,1.0,1,0,True
My daily activity involves running my own business.,1,[],0,0,0.0,0,1021,,0,A34IZFOSHOZ4GN,1.0,1,0,True
I invested ton of money in stocks. ,1,[],0,0,0.0,0,1022,,0,A11ILN5YSUDVG8,1.0,1,0,True
The presentation from today meeting was developed by the business manager.,1,['was developed'],1,1,1.0,1,1023,['was developed'],1,A13CFYL1AW272Y,1.0,2,1,True
The corporation as whole was damaged significantly by the CEO scandal.,1,['was damaged'],1,1,1.0,1,1024,['was damaged'],1,AAFM5PPF9P0W,1.0,2,1,True
I enjoy working here. ,1,[],0,0,0.0,0,1025,,0,A20P819KPQWCK0,1.0,1,0,True
The CEO opinion was not heard by the board.,1,['was not heard'],1,1,1.0,1,1026,,0,A2OKJSKQFMCZTP,1.0,2,1,False
I own my own business.,1,[],0,0,0.0,0,1027,,0,AM0FRMVODTMXA,1.0,1,0,True
I am going to business meeting in one hour. ,1,[],0,0,0.0,0,1028,,0,A2WSYQ5TS09U1,1.0,1,0,True
I am activating my bank account today.,1,[],0,0,0.0,0,1029,,0,A1FAQI8VXLAMBM,2.0,1,0,True
Businesses are very important for the market.,1,[],0,0,0.0,0,1030,,0,A3C9B757QTE20C,2.0,1,0,True
Business is conducted within the hours of 0900-1700,1,['is conducted'],1,1,1.0,1,1031,['is conducted'],1,AK70USZXEJSF3,2.0,2,1,True
My business is very important.,1,[],0,0,0.0,0,1032,,0,A3BWZ6V34W8SXX,2.0,1,0,True
Comic shops were more viable business before the pandemic. ,1,[],0,0,0.0,0,1033,,0,A3U6RDG7BLH6YZ,2.0,1,0,True
Today business world is suffering because of the pandemic.,1,[],0,0,0.0,0,1034,,0,A2HUWXLMG214BI,2.0,2,0,True
The bakery was happy with all of it satisfied customers.,1,[],0,0,0.0,0,1035,,0,A16DIQCMNWPBAN,2.0,2,0,True
I think his business is pretty successful. ,1,[],0,0,0.0,0,1036,,0,A357ADRGNGMMKC,1.0,1,0,True
Their business is secret.,1,[],0,0,0.0,0,1037,,0,A3V2HVY764HJS4,2.0,1,0,True
The business man was sent home because he had fever,1,['was sent'],1,1,1.0,1,1038,['was sent'],1,A2W5PAZJG6X8Q8,2.0,2,1,True
In business it is easy to become millionaire.,1,[],0,0,0.0,0,1039,,0,A118RTS8BOFIH7,1.0,1,0,True
The contract was not signed by the business.,1,['was not signed'],1,1,1.0,1,1040,,0,A31CNXHGR49DJR,1.0,2,1,False
Business is very volatile,1,[],0,0,0.0,0,1041,,0,A3OM2ZQ7FUDTIN,1.0,1,0,True
"We had business to deal with first, then pleasure.",1,[],0,0,0.0,0,1042,,0,A3PSV85ZUXP9VF,2.0,2,0,True
I lost all my money from my pizza business,1,[],0,0,0.0,0,1043,,0,A3G11HOZ5PCWOH,2.0,2,0,True
Businesses suck the money out of folk wallets. ,1,[],0,0,0.0,0,1044,,0,A33ELVLU0NX9N9,1.0,1,0,True
The CEO has an office in an high rise.,1,[],0,0,0.0,0,1045,,0,A2W434UNNBRS4L,1.0,2,0,True
I am in the process of purchasing new car.,1,[],0,0,0.0,0,1046,,0,A2EW08X2I87RXL,2.0,1,0,True
More than 300 employees of the company were laid off on Friday. ,1,['were laid'],1,1,1.0,1,1047,['were laid'],1,AHTWQSOY6HTJI,1.0,2,1,True
That meeting made me feel so nervous.,1,[],0,0,0.0,0,1048,,0,A16Y5JEB1EF9CY,1.0,2,0,True
Business is not very fun.,1,[],0,0,0.0,0,1049,,0,A3M0L33TPD346S,2.0,2,0,True
The CEO of that company earned very high bonus this year.,1,[],0,0,0.0,0,1050,,0,AY4KZOUEZ8BAM,1.0,1,0,True
Business is in the heart of commerce.,1,[],0,0,0.0,0,1051,,0,A14Z1JSAR9JEON,1.0,2,0,True
Mind you business and stay outta mines.,1,[],0,0,0.0,0,1052,,0,A3M2Q7EZCJ85GE,2.0,2,0,True
His business grew to hugh success over night. ,1,[],0,0,0.0,0,1053,,0,A36W1PIV68AE5K,2.0,2,0,True
I would like to receive payment for my private business.,1,[],0,0,0.0,0,1054,,0,ANR81FZBHHR0F,1.0,1,0,True
The business closed after their hours of operation.,1,[],0,0,0.0,0,1055,,0,A2UOOBZQ5L2EL1,2.0,2,0,True
Keeping his business is what keeps Steve working so hard.,1,[],0,0,0.0,0,1056,,0,j2wj0096lt,2.0,1,0,True
WE are skyrocketing ,1,[],0,0,0.0,0,1057,,0,A3NUGUAMBKYMZY,1.0,1,0,True
Business has been bad lately.,1,[],0,0,0.0,0,1058,,0,A33TBDS0UALKW2,1.0,1,0,True
